{"backend":"oci:docker","controls":["source_read_only","scratch_overlay","network_deny","process_isolation","resource_limits","secret_redaction"],"dependencies":[],"digest":"sha256:55d7d242a7f208a96fa8602486e5ea9a25bd081586e2c72dcae670ff80be1703","limits":{"cpu_cores":1,"memory_bytes":2147483648,"output_bytes":16777216,"processes":128,"scratch_bytes":4294967296,"scratch_entries":100000,"wall_time_seconds":900},"lock_digest":"sha256:cccccccccccccccccccccccccccccccccccccccccccccccccccccccccccccccc","network":{"destinations":[],"mode":"deny"},"provider_profile":"github-semantic-v1","runtime":{"boot_digest":null,"capability_fingerprint":null,"helper_digest":null,"kind":"oci-capsule","rootfs_digest":"sha256:aaaaaaaaaaaaaaaaaaaaaaaaaaaaaaaaaaaaaaaaaaaaaaaaaaaaaaaaaaaaaaaa","runner_platform":"linux-x86_64","workload_digest":"sha256:aaaaaaaaaaaaaaaaaaaaaaaaaaaaaaaaaaaaaaaaaaaaaaaaaaaaaaaaaaaaaaaa"},"scenario_digest":"sha256:dddddddddddddddddddddddddddddddddddddddddddddddddddddddddddddddd","schema":"runner-v2","secret_names":[],"selected_jobs":["build"],"source_digest":"sha256:bbbbbbbbbbbbbbbbbbbbbbbbbbbbbbbbbbbbbbbbbbbbbbbbbbbbbbbbbbbbbbbb","status":{"state":"complete"},"steps":[{"argv":["/bin/sh","-eu","-c","true"],"environment":{},"id":"build:step1","image":"sha256:aaaaaaaaaaaaaaaaaaaaaaaaaaaaaaaaaaaaaaaaaaaaaaaaaaaaaaaaaaaaaaaa","supported":true,"working_directory":"/workspace"}]}
